paper_id,title,abstract,year,authors,source_db,source_url,query
openalex:W1574901103,Foundations of statistical natural language processing,"Statistical approaches to processing natural language text have become dominant in recent years. This foundational text is the first comprehensive introduction to statistical natural language processing (NLP) to appear. The book contains all the theory and algorithms needed for building NLP tools. It provides broad but rigorous coverage of mathematical and linguistic foundations, as well as detailed discussion of statistical methods, allowing students and researchers to construct their own implementations. The book covers collocation finding, word sense disambiguation, probabilistic parsing, information retrieval, and other applications.",1999,Christopher D. Manning;Hinrich Schütze,OpenAlex,https://openalex.org/W1574901103,natural language processing
openalex:W2979826702,Transformers: State-of-the-Art Natural Language Processing,"Thomas Wolf, Lysandre Debut, Victor Sanh, Julien Chaumond, Clement Delangue, Anthony Moi, Pierric Cistac, Tim Rault, Remi Louf, Morgan Funtowicz, Joe Davison, Sam Shleifer, Patrick von Platen, Clara Ma, Yacine Jernite, Julien Plu, Canwen Xu, Teven Le Scao, Sylvain Gugger, Mariama Drame, Quentin Lhoest, Alexander Rush. Proceedings of the 2020 Conference on Empirical Methods in Natural Language Processing: System Demonstrations. 2020.",2020,Thomas Wolf;Lysandre Debut;Victor Sanh;Julien Chaumond;Clément Delangue;Anthony Moi;Pierric Cistac;Tim Rault;Rémi Louf;Morgan Funtowicz;Joe Davison;Sam Shleifer;Patrick von Platen;Clara Ma;Yacine Jernite;Julien Plu;Canwen Xu;Teven Le Scao;Sylvain Gugger;Mariama Drame;Quentin Lhoest;Alexander M. Rush,OpenAlex,https://openalex.org/W2979826702,natural language processing
openalex:W2123442489,The Stanford CoreNLP Natural Language Processing Toolkit,"Christopher Manning, Mihai Surdeanu, John Bauer, Jenny Finkel, Steven Bethard, David McClosky. Proceedings of 52nd Annual Meeting of the Association for Computational Linguistics: System Demonstrations. 2014.",2014,Christopher D. Manning;Mihai Surdeanu;John Bauer;Jenny Rose Finkel;Steven Bethard;David McClosky,OpenAlex,https://openalex.org/W2123442489,natural language processing
openalex:W2158899491,Natural Language Processing (almost) from Scratch,"We propose a unified neural network architecture and learning algorithm that can be applied to various natural language processing tasks including: part-of-speech tagging, chunking, named entity recognition, and semantic role labeling. This versatility is achieved by trying to avoid task-specific engineering and therefore disregarding a lot of prior knowledge. Instead of exploiting man-made input features carefully optimized for each task, our system learns internal representations on the basis of vast amounts of mostly unlabeled training data. This work is then used as a basis for building a freely available tagging system with good performance and minimal computational requirements.",2011,Ronan Collobert;Jason Weston;Léon Bottou;Michael Karlen;Koray Kavukcuoglu;Pavel P. Kuksa,OpenAlex,https://openalex.org/W2158899491,natural language processing
openalex:W2117130368,A unified architecture for natural language processing,"We describe a single convolutional neural network architecture that, given a sentence, outputs a host of language processing predictions: part-of-speech tags, chunks, named entity tags, semantic roles, semantically similar words and the likelihood that the sentence makes sense (grammatically and semantically) using a language model. The entire network is trained jointly on all these tasks using weight-sharing, an instance of multitask learning. All the tasks use labeled data except the language model which is learnt from unlabeled text and represents a novel form of semi-supervised learning for the shared tasks. We show how both multitask learning and semi-supervised learning improve the generalization of the shared tasks, resulting in state-of-the-art-performance.",2008,Ronan Collobert;Jason Weston,OpenAlex,https://openalex.org/W2117130368,natural language processing
openalex:W1521626219,Natural Language Processing with Python,"This book offers a highly accessible introduction to natural language processing, the field that supports a variety of language technologies, from predictive text and email filtering to automatic summarization and translation. With it, you'll learn how to write Python programs that work with large collections of unstructured text. You'll access richly annotated datasets using a comprehensive range of linguistic data structures, and you'll understand the main algorithms for analyzing the content and structure of written communication. Packed with examples and exercises, Natural Language Processing with Python will help you: Extract information from unstructured text, either to guess the topic or identify named entities Analyze linguistic structure in text, including parsing and semantic analysis Access popular linguistic databases, including WordNet and treebanks Integrate techniques drawn from fields as diverse as linguistics and artificial intelligence This book will help you gain practical skills in natural language processing using the Python programming language and the Natural Language Toolkit (NLTK) open source library. If you're interested in developing web applications, analyzing multilingual news sources, or documenting endangered languages -- or if you're simply curious to have a programmer's perspective on how human language works -- you'll find Natural Language Processing with Python both fascinating and immensely useful.",2009,Steven Bird;Ewan Klein;Edward Loper,OpenAlex,https://openalex.org/W1521626219,natural language processing
openalex:W2096175520,A maximum entropy approach to natural language processing,"The concept of maximum entropy can be traced back along multiple threads to Biblical times. Only recently, however, have computers become powerful enough to permit the widescale application of this concept to real world problems in statistical estimation and pattern recognition. In this paper, we describe a method for statistical modeling based on maximum entropy. We present a maximum-likelihood approach for automatically constructing maximum entropy models and describe how to implement this approach efficiently, using as examples several problems in natural language processing.",1996,Adam Berger;Vincent J. Della Pietra;Stephen A. Della Pietra,OpenAlex,https://openalex.org/W2096175520,natural language processing
openalex:W2980282514,HuggingFace's Transformers: State-of-the-art Natural Language Processing,"Recent progress in natural language processing has been driven by advances in both model architecture and model pretraining. Transformer architectures have facilitated building higher-capacity models and pretraining has made it possible to effectively utilize this capacity for a wide variety of tasks. \textit{Transformers} is an open-source library with the goal of opening up these advances to the wider machine learning community. The library consists of carefully engineered state-of-the art Transformer architectures under a unified API. Backing this library is a curated collection of pretrained models made by and available for the community. \textit{Transformers} is designed to be extensible by researchers, simple for practitioners, and fast and robust in industrial deployments. The library is available at \url{https://github.com/huggingface/transformers}.",2019,"Thomas Wolf;Lysandre Debut;Victor Sanh;Julien Chaumond;Clément Delangue;Anthony Moi;Pierric Cistac;Tim Rault;Rémi Louf;Morgan Funtowicz;Jamie Brew;Shleifer, Sam;von Platen, Patrick;Ma, Clara;Jernite, Yacine;Plu, Julien;Xu, Canwen;Scao, Teven Le;Gugger, Sylvain;Drame, Mariama;Lhoest, Quentin;Rush, Alexander M.",OpenAlex,https://openalex.org/W2980282514,natural language processing
openalex:W1579838312,"Speech and Language Processing: An Introduction to Natural Language Processing, Computational Linguistics, and Speech Recognition","This book takes an empirical approach to language processing, based on applying statistical and other machine-learning algorithms to large corpora.Methodology boxes are included in each chapter. Each chapter is built around one or more worked examples to demonstrate the main idea of the chapter. Covers the fundamental algorithms of various fields, whether originally proposed for spoken or written language to demonstrate how the same algorithm can be used for speech recognition and word-sense disambiguation. Emphasis on web and other practical applications. Emphasis on scientific evaluation. Useful as a reference for professionals in any of the areas of speech and language processing.",2000,Daniel Jurafsky;James Martin,OpenAlex,https://openalex.org/W1579838312,natural language processing
openalex:W3185341429,"Pre-train, Prompt, and Predict: A Systematic Survey of Prompting Methods in Natural Language Processing","This article surveys and organizes research works in a new paradigm in natural language processing, which we dub “prompt-based learning.” Unlike traditional supervised learning, which trains a model to take in an input x and predict an output y as P ( y|x ), prompt-based learning is based on language models that model the probability of text directly. To use these models to perform prediction tasks, the original input x is modified using a template into a textual string prompt x′ that has some unfilled slots, and then the language model is used to probabilistically fill the unfilled information to obtain a final string x̂ , from which the final output y can be derived. This framework is powerful and attractive for a number of reasons: It allows the language model to be pre-trained on massive amounts of raw text, and by defining a new prompting function the model is able to perform few-shot or even zero-shot learning, adapting to new scenarios with few or no labeled data. In this article, we introduce the basics of this promising paradigm, describe a unified set of mathematical notations that can cover a wide variety of existing work, and organize existing work along several dimensions, e.g., the choice of pre-trained language models, prompts, and tuning strategies. To make the field more accessible to interested beginners, we not only make a systematic review of existing works and a highly structured typology of prompt-based concepts but also release other resources, e.g., a website NLPedia–Pretrain including constantly updated survey and paperlist.",2022,Pengfei Liu;Weizhe Yuan;Jinlan Fu;Zhengbao Jiang;Hiroaki Hayashi;Graham Neubig,OpenAlex,https://openalex.org/W3185341429,natural language processing
openalex:W1663984431,Advances in natural language processing,"Natural language processing employs computational techniques for the purpose of learning, understanding, and producing human language content. Early computational approaches to language research focused on automating the analysis of the linguistic structure of language and developing basic technologies such as machine translation, speech recognition, and speech synthesis. Today's researchers refine and make use of such tools in real-world applications, creating spoken dialogue systems and speech-to-speech translation engines, mining social media for information about health or finance, and identifying sentiment and emotion toward products and services. We describe successes and challenges in this rapidly advancing area.",2015,Julia Hirschberg;Christopher D. Manning,OpenAlex,https://openalex.org/W1663984431,natural language processing
openalex:W2884001105,Recent Trends in Deep Learning Based Natural Language Processing [Review Article],"Deep learning methods employ multiple processing layers to learn hierarchical representations of data, and have produced state-of-the-art results in many domains. Recently, a variety of model designs and methods have blossomed in the context of natural language processing (NLP). In this paper, we review significant deep learning related models and methods that have been employed for numerous NLP tasks and provide a walk-through of their evolution. We also summarize, compare and contrast the various models and put forward a detailed understanding of the past, present and future of deep learning in NLP.",2018,Tom Young;Devamanyu Hazarika;Soujanya Poria;Erik Cambria,OpenAlex,https://openalex.org/W2884001105,natural language processing
openalex:W2169818249,Natural language processing: an introduction,"We describe the historical evolution of NLP, and summarize common NLP sub-problems in this extensive field. We then provide a synopsis of selected highlights of medical NLP efforts. After providing a brief description of common machine-learning approaches that are being used for diverse NLP sub-problems, we discuss how modern NLP architectures are designed, with a summary of the Apache Foundation's Unstructured Information Management Architecture. We finally consider possible future directions for NLP, and reflect on the possible impact of IBM Watson on the medical field.",2011,Prakash M. Nadkarni;Lucila Ohno‐Machado;Wendy W. Chapman,OpenAlex,https://openalex.org/W2169818249,natural language processing
openalex:W2930957955,Proceedings of the Conference on Empirical Methods in Natural Language Processing - EMNLP '08,"Welcome to the 2008 Conference on Empirical Methods in Natural Language Processing! The conference is organized under the auspices of SIGDAT, the ACL Special Interest Group for linguistic data and corpus-based approaches to natural language processing. It is co-located this year with AMTA 2008 and the International Workshop on Spoken Language Translation, in Honolulu, Hawaii. EMNLP received 385 submissions. We were able to accept 116 papers in total (an acceptance rate of 30%). 81 of the papers (21%) were accepted for oral presentation, and 35 (9%) for poster presentation. Two poster papers were subsequently withdrawn after acceptance. The papers were selected by a program committee of 15 area chairs, from Asia, Europe, and North America, assisted by a panel of 339 reviewers. This year EMNLP introduced an author response period. Authors were able to read and respond to the reviews of their paper before the program committee made a final decision. They were asked to correct factual errors in the reviews and answer questions raised in the reviewer comments. The intention was to help produce more accurate reviews. In some cases, reviewers changed their scores in view of the authors' response and the area chairs read all responses carefully prior to making recommendations for acceptance.",2008,,OpenAlex,https://openalex.org/W2930957955,natural language processing
openalex:W3046375318,Domain-Specific Language Model Pretraining for Biomedical Natural Language Processing,"Pretraining large neural language models, such as BERT, has led to impressive gains on many natural language processing (NLP) tasks. However, most pretraining efforts focus on general domain corpora, such as newswire and Web. A prevailing assumption is that even domain-specific pretraining can benefit by starting from general-domain language models. In this article, we challenge this assumption by showing that for domains with abundant unlabeled text, such as biomedicine, pretraining language models from scratch results in substantial gains over continual pretraining of general-domain language models. To facilitate this investigation, we compile a comprehensive biomedical NLP benchmark from publicly available datasets. Our experiments show that domain-specific pretraining serves as a solid foundation for a wide range of biomedical NLP tasks, leading to new state-of-the-art results across the board. Further, in conducting a thorough evaluation of modeling choices, both for pretraining and task-specific fine-tuning, we discover that some common practices are unnecessary with BERT models, such as using complex tagging schemes in named entity recognition. To help accelerate research in biomedical NLP, we have released our state-of-the-art pretrained and task-specific models for the community, and created a leaderboard featuring our BLURB benchmark (short for Biomedical Language Understanding &amp; Reasoning Benchmark) at https://aka.ms/BLURB .",2021,裕二 池谷;Robert Tinn;Hao Cheng;Michael Lucas;Naoto Usuyama;Xiaodong Liu;Tristan Naumann;Jianfeng Gao;Hoifung Poon,OpenAlex,https://openalex.org/W3046375318,natural language processing
openalex:W1410460,Handbook of Natural Language Processing,"The Handbook of Natural Language Processing, Second Edition presents practical tools and techniques for implementing natural language processing in computer systems. Along with removing outdated material, this edition updates every chapter and expands the content to include emerging areas, such as sentiment analysis.New to the Second EditionGreater",2010,Nitin Indurkhya;Fred J. Damerau,OpenAlex,https://openalex.org/W1410460,natural language processing
openalex:W4205807230,Proceedings of the 2021 Conference on Empirical Methods in Natural Language Processing,"EMNLP 2021 is one of the first hybrid conferences in the field of natural language processing.It is also for us, the organizing team, uncharted domain.Organizing a hybrid conference has felt like organizing two conferences, a virtual one and an in-person one, which seamlessly must work together and with a kind of multi-task objective make the conference experience synergistic and successful both remotely and in person.With this challenge come opportunities.The hybrid format allows remote participation in a conference that is held onsite in Punta Cana, The Dominican Republic, and allows creating a real conference feeling for those who do not want to travel the many miles from the other side of the world and increase their carbon footprint, and for those who have budget restrictions for traveling.We welcome you all!As in previous years, the purpose of the General Chair's preface is to express thanks to the amazing team of organizing chairs whose heroic efforts made this hybrid conference possible.The organizing team includes:• The Programme Chairs -Xuanjing Huang, Lucia Specia and Scott Yih -who did a tremendous job to manage the reviewing process and set up an outstanding scientific program.• The Senior Area Chairs, Area Chairs and Reviewers whose expertise enabled authors to learn from their reviews and to deliver papers that improved on their original submissions.• The Demonstration Chairs -Heike Adel and Shuming Shi -who selected outstanding demonstrations",2021,,OpenAlex,https://openalex.org/W4205807230,natural language processing
openalex:W3037109418,Stanza: A Python Natural Language Processing Toolkit for Many Human Languages,"We introduce Sta n z a , an open-source Python natural language processing toolkit supporting 66 human languages. Compared to existing widely used toolkits, Sta n z a features a language-agnostic fully neural pipeline for text analysis, including tokenization, multiword token expansion, lemmatization, part-ofspeech and morphological feature tagging, dependency parsing, and named entity recognition. We have trained Sta n z a on a total of 112 datasets, including the Universal Dependencies treebanks and other multilingual corpora, and show that the same neural architecture generalizes well and achieves competitive performance on all languages tested. Additionally, Sta n z a includes a native Python interface to the widely used Java Stanford CoreNLP software, which further extends its functionality to cover other tasks such as coreference resolution and relation extraction. Source code, documentation, and pretrained models for 66 languages are available at https:// stanfordnlp.github.io/stanza/.",2020,Peng Qi;Yuhao Zhang;Yuhui Zhang;Jason Bolton;Christopher D. Manning,OpenAlex,https://openalex.org/W3037109418,natural language processing
openalex:W2742947407,Recent Trends in Deep Learning Based Natural Language Processing,"Deep learning methods employ multiple processing layers to learn hierarchical representations of data and have produced state-of-the-art results in many domains. Recently, a variety of model designs and methods have blossomed in the context of natural language processing (NLP). In this paper, we review significant deep learning related models and methods that have been employed for numerous NLP tasks and provide a walk-through of their evolution. We also summarize, compare and contrast the various models and put forward a detailed understanding of the past, present and future of deep learning in NLP.",2017,Tom Young;Devamanyu Hazarika;Soujanya Poria;Erik Cambria,OpenAlex,https://openalex.org/W2742947407,natural language processing
openalex:W1516184288,Proceedings of the 2013 Conference on Empirical Methods in Natural Language Processing,"Welcome to EMNLP 2010, Conference on Empirical Methods in Natural Language Processing! The conference is organized by SIGDAT, the Association for Computational Linguistics' special interest group on linguistic data and corpus-based approaches to NLP, and is held this year as a stand-alone conference at the MIT Stata Center, Massachusetts, USA on October 9-11. EMNLP 2010 received 500 submissions, a new record for the conference. The program committee was able to accept 125 papers in total (an acceptance rate of 25%). Among them, 70 of the papers (14%) were accepted for oral presentations, and 55 (11%) for poster presentations. The PC, which consists of 18 area chairs and 460 PC members from Asia, Europe, and North America, worked together to create a strong program with high quality oral and poster presentations and enlightening invited talks.",2013,,OpenAlex,https://openalex.org/W1516184288,natural language processing
openalex:W2117400858,Transformation-based error-driven learning and natural language processing: a case study in part-of-speech tagging,"Recently, there has been a rebirth of empiricism in the eld of natural language processing. Manual encoding of linguistic information is being challenged by automated corpus-based learning as a method ofproviding a natural language processing system with linguistic knowledge. Although corpus-based approaches have been successful in many different areas of natural language processing, it is often the case that these methods capture the linguistic information they are modelling indirectly in large opaque tables of statistics. This can make it di cult to analyze, understand and improve the ability of these approaches to model underlying linguistic behavior. In this paper, we will describe a simple rule-based approach to automated learning of linguistic knowledge. This approach has been shown for a number of tasks to capture information in a clearer and more direct fashion without a compromise in performance. We present a detailed case study of this learning method applied topart of speech tagging. 1.",1995,Eric Brill,OpenAlex,https://openalex.org/W2117400858,natural language processing
openalex:W2740168486,A Survey on Hate Speech Detection using Natural Language Processing,"This paper presents a survey on hate speech detection.Given the steadily growing body of social media content, the amount of online hate speech is also increasing.Due to the massive scale of the web, methods that automatically detect hate speech are required.Our survey describes key areas that have been explored to automatically recognize these types of utterances using natural language processing.We also discuss limits of those approaches.",2017,Anna Grau Schmidt;Michael Wiegand,OpenAlex,https://openalex.org/W2740168486,natural language processing
openalex:W2031213082,Natural language processing,conducted domain-specific NLP studies,2003,Gobinda Chowdhury,OpenAlex,https://openalex.org/W2031213082,natural language processing
openalex:W2587019100,Comparative Study of CNN and RNN for Natural Language Processing,"Deep neural networks (DNN) have revolutionized the field of natural language processing (NLP). Convolutional neural network (CNN) and recurrent neural network (RNN), the two main types of DNN architectures, are widely explored to handle various NLP tasks. CNN is supposed to be good at extracting position-invariant features and RNN at modeling units in sequence. The state of the art on many NLP tasks often switches due to the battle between CNNs and RNNs. This work is the first systematic comparison of CNN and RNN on a wide range of representative NLP tasks, aiming to give basic guidance for DNN selection.",2017,Wenpeng Yin;Katharina Kann;Mo Yu;Hinrich Schütze,OpenAlex,https://openalex.org/W2587019100,natural language processing
