paper_id,title,abstract,year,authors,source_db,source_url,query
openalex:W2546938941,Dual Learning for Machine Translation,"While neural machine translation (NMT) is making good progress in the past two years, tens of millions of bilingual sentence pairs are needed for its training. However, human labeling is very costly. To tackle this training data bottleneck, we develop a dual-learning mechanism, which can enable an NMT system to automatically learn from unlabeled data through a dual-learning game. This mechanism is inspired by the following observation: any machine translation task has a dual task, e.g., English-to-French translation (primal) versus French-to-English translation (dual); the primal and dual tasks can form a closed loop, and generate informative feedback signals to train the translation models, even if without the involvement of a human labeler. In the dual-learning mechanism, we use one agent to represent the model for the primal task and the other agent to represent the model for the dual task, then ask them to teach each other through a reinforcement learning process. Based on the feedback signals generated during this process (e.g., the language-model likelihood of the output of a model, and the reconstruction error of the original sentence after the primal and dual translations), we can iteratively update the two models until convergence (e.g., using the policy gradient methods). We call the corresponding approach to neural machine translation \emph{dual-NMT}. Experiments show that dual-NMT works very well on English$\leftrightarrow$French translation; especially, by learning from monolingual data (with 10% bilingual data for warm start), it achieves a comparable accuracy to NMT trained from the full bilingual data for the French-to-English translation task.",2016,Di He;Yingce Xia;Tao Qin;Liwei Wang;Nenghai Yu;Tie‐Yan Liu;Wei‐Ying Ma,OpenAlex,https://openalex.org/W2546938941,machine translation
openalex:W2963260202,Modeling Coverage for Neural Machine Translation,"Attention mechanism has enhanced stateof-the-art Neural Machine Translation (NMT) by jointly learning to align and translate.It tends to ignore past alignment information, however, which often leads to over-translation and under-translation.To address this problem, we propose coverage-based NMT in this paper.We maintain a coverage vector to keep track of the attention history.The coverage vector is fed to the attention model to help adjust future attention, which lets NMT system to consider more about untranslated source words.Experiments show that the proposed approach significantly improves both translation quality and alignment quality over standard attention-based NMT. 1",2016,Zhaopeng Tu;Zhengdong Lu;Yang Liu;Xiaohua Liu;Hang Li,OpenAlex,https://openalex.org/W2963260202,machine translation
openalex:W2162245945,Clause restructuring for statistical machine translation,"We describe a method for incorporating syntactic information in statistical machine translation systems. The first step of the method is to parse the source language string that is being translated. The second step is to apply a series of transformations to the parse tree, effectively reordering the surface string on the source language side of the translation system. The goal of this step is to recover an underlying word order that is closer to the target language word-order than the original string. The reordering approach is applied as a pre-processing step in both the training and decoding phases of a phrase-based statistical MT system. We describe experiments on translation from German to English, showing an improvement from 25.2% Bleu score for a baseline system to 26.8% Bleu score for the system with reordering, a statistically significant improvement.",2005,Michael Collins;Philipp Koehn;Ivona Kučerová,OpenAlex,https://openalex.org/W2162245945,machine translation
openalex:W1489525520,Re-evaluating the Role of Bleu in Machine Translation Research,"We argue that the machine translation community is overly reliant on the Bleu machine translation evaluation metric. We show that an improved Bleu score is neither necessary nor sufficient for achieving an actual improvement in translation quality, and give two significant counterexamples to Bleu&amp;apos;s correlation with human judgments of quality. This offers new potential for research which was previously deemed unpromising by an inability to improve upon Bleu scores.",2006,Chris Callison-Burch;Miles Osborne;Philipp Koehn,OpenAlex,https://openalex.org/W1489525520,machine translation
openalex:W2512924740,Findings of the 2016 Conference on Machine Translation,"Ondřej Bojar, Rajen Chatterjee, Christian Federmann, Yvette Graham, Barry Haddow, Matthias Huck, Antonio Jimeno Yepes, Philipp Koehn, Varvara Logacheva, Christof Monz, Matteo Negri, Aurélie Névéol, Mariana Neves, Martin Popel, Matt Post, Raphael Rubino, Carolina Scarton, Lucia Specia, Marco Turchi, Karin Verspoor, Marcos Zampieri. Proceedings of the First Conference on Machine Translation: Volume 2, Shared Task Papers. 2016.",2016,Ondřej Bojar;Rajen Chatterjee;Christian Federmann;Yvette Graham;Barry Haddow;Matthias Huck;Antonio Jimeno Yepes;Philipp Koehn;Varvara Logacheva;Christof Monz;Matteo Negri;Aurélie Névéol;Mariana Neves;Martin Popel;Matt Post;Raphaël Rubino;Carolina Scarton;Lucia Specia;Marco Turchi;Karin Verspoor;Marcos Zampieri,OpenAlex,https://openalex.org/W2512924740,machine translation
arxiv:2603.12240v1,BiGain: Unified Token Compression for Joint Generation and Classification,"Acceleration methods for diffusion models (e.g., token merging or downsampling) typically optimize synthesis quality under reduced compute, yet often ignore discriminative capacity. We revisit token compression with a joint objective and present BiGain, a training-free, plug-and-play framework that preserves generation quality while improving classification in accelerated diffusion models. Our key insight is frequency separation: mapping feature-space signals into a frequency-aware representation disentangles fine detail from global semantics, enabling compression that respects both generative fidelity and discriminative utility. BiGain reflects this principle with two frequency-aware operators: (1) Laplacian-gated token merging, which encourages merges among spectrally smooth tokens while discouraging merges of high-contrast tokens, thereby retaining edges and textures; and (2) Interpolate-Extrapolate KV Downsampling, which downsamples keys/values via a controllable interextrapolation between nearest and average pooling while keeping queries intact, thereby conserving attention precision. Across DiT- and U-Net-based backbones and ImageNet-1K, ImageNet-100, Oxford-IIIT Pets, and COCO-2017, our operators consistently improve the speed-accuracy trade-off for diffusion-based classification, while maintaining or enhancing generation quality under comparable acceleration. For instance, on ImageNet-1K, with 70% token merging on Stable Diffusion 2.0, BiGain increases classification accuracy by 7.15% while improving FID by 0.34 (1.85%). Our analyses indicate that balanced spectral retention, preserving high-frequency detail and low/mid-frequency semantics, is a reliable design rule for token compression in diffusion models. To our knowledge, BiGain is the first framework to jointly study and advance both generation and classification under accelerated diffusion, supporting lower-cost deployment.",2026,Jiacheng Liu;Shengkun Tang;Jiacheng Cui;Dongkuan Xu;Zhiqiang Shen,arXiv,http://arxiv.org/abs/2603.12240v1,machine translation
arxiv:2603.12230v1,Security Considerations for Artificial Intelligence Agents,"This article, a lightly adapted version of Perplexity's response to NIST/CAISI Request for Information 2025-0035, details our observations and recommendations concerning the security of frontier AI agents. These insights are informed by Perplexity's experience operating general-purpose agentic systems used by millions of users and thousands of enterprises in both controlled and open-world environments. Agent architectures change core assumptions around code-data separation, authority boundaries, and execution predictability, creating new confidentiality, integrity, and availability failure modes. We map principal attack surfaces across tools, connectors, hosting boundaries, and multi-agent coordination, with particular emphasis on indirect prompt injection, confused-deputy behavior, and cascading failures in long-running workflows. We then assess current defenses as a layered stack: input-level and model-level mitigations, sandboxed execution, and deterministic policy enforcement for high-consequence actions. Finally, we identify standards and research gaps, including adaptive security benchmarks, policy models for delegation and privilege control, and guidance for secure multi-agent system design aligned with NIST risk management principles.",2026,Ninghui Li;Kaiyuan Zhang;Kyle Polley;Jerry Ma,arXiv,http://arxiv.org/abs/2603.12230v1,machine translation
arxiv:2603.12228v1,Neural Thickets: Diverse Task Experts Are Dense Around Pretrained Weights,"Pretraining produces a learned parameter vector that is typically treated as a starting point for further iterative adaptation. In this work, we instead view the outcome of pretraining as a distribution over parameter vectors, whose support already contains task-specific experts. We show that in small models such expert solutions occupy a negligible fraction of the volume of this distribution, making their discovery reliant on structured optimization methods such as gradient descent. In contrast, in large, well-pretrained models the density of task-experts increases dramatically, so that diverse, task-improving specialists populate a substantial fraction of the neighborhood around the pretrained weights. Motivated by this perspective, we explore a simple, fully parallel post-training method that samples $N$ parameter perturbations at random, selects the top $K$, and ensembles predictions via majority vote. Despite its simplicity, this approach is competitive with standard post-training methods such as PPO, GRPO, and ES for contemporary large-scale models.",2026,Yulu Gan;Phillip Isola,arXiv,http://arxiv.org/abs/2603.12228v1,machine translation
arxiv:2603.12222v1,HiAP: A Multi-Granular Stochastic Auto-Pruning Framework for Vision Transformers,"Vision Transformers require significant computational resources and memory bandwidth, severely limiting their deployment on edge devices. While recent structured pruning methods successfully reduce theoretical FLOPs, they typically operate at a single structural granularity and rely on complex, multi-stage pipelines with post-hoc thresholding to satisfy sparsity budgets. In this paper, we propose Hierarchical Auto-Pruning (HiAP), a continuous relaxation framework that discovers optimal sub-networks in a single end-to-end training phase without requiring manual importance heuristics or predefined per-layer sparsity targets. HiAP introduces stochastic Gumbel-Sigmoid gates at multiple granularities: macro-gates to prune entire attention heads and FFN blocks, and micro-gates to selectively prune intra-head dimensions and FFN neurons. By optimizing both levels simultaneously, HiAP addresses both the memory-bound overhead of loading large matrices and the compute-bound mathematical operations. HiAP naturally converges to stable sub-networks using a loss function that incorporates both structural feasibility penalties and analytical FLOPs. Extensive experiments on ImageNet demonstrate that HiAP organically discovers highly efficient architectures, and achieves a competitive accuracy-efficiency Pareto frontier for models like DeiT-Small, matching the performance of sophisticated multi-stage methods while significantly simplifying the deployment pipeline.",2026,Andy Li;Aiden Durrant;Milan Markovic;Georgios Leontidis,arXiv,http://arxiv.org/abs/2603.12222v1,machine translation
arxiv:2603.12201v1,IndexCache: Accelerating Sparse Attention via Cross-Layer Index Reuse,"Long-context agentic workflows have emerged as a defining use case for large language models, making attention efficiency critical for both inference speed and serving cost. Sparse attention addresses this challenge effectively, and DeepSeek Sparse Attention (DSA) is a representative production-grade solution: a lightweight lightning indexer selects the top-k most relevant tokens per query, reducing core attention from $O(L^2)$ to $O(Lk)$. However, the indexer itself retains $O(L^2)$ complexity and must run independently at every layer, despite the fact that the resulting top-k selections are highly similar across consecutive layers. We present IndexCache, which exploits this cross-layer redundancy by partitioning layers into a small set of Full layers that run their own indexers and a majority of Shared layers that simply reuse the nearest Full layer's top-k indices. We propose two complementary approaches to determine and optimize this configuration. Training-free IndexCache applies a greedy search algorithm that selects which layers to retain indexers by directly minimizing language modeling loss on a calibration set, requiring no weight updates. Training-aware IndexCache introduces a multi-layer distillation loss that trains each retained indexer against the averaged attention distributions of all layers it serves, enabling even simple interleaved patterns to match full-indexer accuracy. Experimental results on a 30B DSA model show that IndexCache can remove 75% of indexer computations with negligible quality degradation, achieving up to 1.82$\times$ prefill speedup and 1.48$\times$ decode speedup compared to standard DSA. These positive results are further confirmed by our preliminary experiments on the production-scale GLM-5 model (Figure 1).",2026,Yushi Bai;Qian Dong;Ting Jiang;Xin Lv;Zhengxiao Du;Aohan Zeng;Jie Tang;Juanzi Li,arXiv,http://arxiv.org/abs/2603.12201v1,machine translation
arxiv:2603.12183v1,Proof-Carrying Materials: Falsifiable Safety Certificates for Machine-Learned Interatomic Potentials,"Machine-learned interatomic potentials (MLIPs) are deployed for high-throughput materials screening without formal reliability guarantees. We show that a single MLIP used as a stability filter misses 93% of density functional theory (DFT)-stable materials (recall 0.07) on a 25,000-material benchmark. Proof-Carrying Materials (PCM) closes this gap through three stages: adversarial falsification across compositional space, bootstrap envelope refinement with 95% confidence intervals, and Lean 4 formal certification. Auditing CHGNet, TensorNet and MACE reveals architecture-specific blind spots with near-zero pairwise error correlations (r <= 0.13; n = 5,000), confirmed by independent Quantum ESPRESSO validation (20/20 converged; median DFT/CHGNet force ratio 12x). A risk model trained on PCM-discovered features predicts failures on unseen materials (AUC-ROC = 0.938 +/- 0.004) and transfers across architectures (cross-MLIP AUC-ROC ~ 0.70; feature importance r = 0.877). In a thermoelectric screening case study, PCM-audited protocols discover 62 additional stable materials missed by single-MLIP screening - a 25% improvement in discovery yield.",2026,Abhinaba Basu;Pavan Chakraborty,arXiv,http://arxiv.org/abs/2603.12183v1,machine translation
arxiv:2603.12167v1,"Operator Splitting, Policy Iteration, and Machine Learning for Stochastic Optimal Control","We propose a splitting approach to solve the second-order Hamilton--Jacobi equation, reducing it to a heat step and a purely first-order step. The latter is implemented using a gradient value policy iteration algorithm, enabling efficient characteristic-based machine learning methods. We establish convergence rates for the splitting method. In particular, the $L^\infty$ error is bounded below by $\mathcal{O}(h)$ and above by $\mathcal{O}(h^{1/7})$ for Lipschitz initial data; this improves to $\mathcal{O}(h^{1/5})$ for semiconcave data and to $\mathcal{O}(h^{1/3})$ for $C^2$ data. We also prove an upper $L^1$ error estimate of order $\mathcal{O}(h^{1/2})$ in the periodic setting, where $h$ is the splitting step. For the first-order step, we provide a weighted $L^2$ error analysis that shows exponential convergence. Each iteration solves linear characteristic equations and learns the value function by minimizing a weighted value gradient loss. The approach yields stable and accurate numerical results.",2026,Alain Bensoussan;Thien P. B. Nguyen;Minh-Binh Tran;Son N. T. Tu,arXiv,http://arxiv.org/abs/2603.12167v1,machine translation
arxiv:2603.12163v1,A Quantitative Characterization of Forgetting in Post-Training,"Continual post-training of generative models is widely used, yet a principled understanding of when and why forgetting occurs remains limited. We develop theoretical results under a two-mode mixture abstraction (representing old and new tasks), proposed by Chen et al. (2025) (arXiv:2510.18874), and formalize forgetting in two forms: (i) mass forgetting, where the old mixture weight collapses to zero, and (ii) old-component drift, where an already-correct old component shifts during training. For equal-covariance Gaussian modes, we prove that forward-KL objectives trained on data from the new distribution drive the old weight to zero, while reverse-KL objectives converge to the true target (thereby avoiding mass forgetting) and perturb the old mean only through overlap-gated misassignment probabilities controlled by the Bhattacharyya coefficient, yielding drift that decays exponentially with mode separation and a locally well-conditioned geometry with exponential convergence. We further quantify how replay interacts with these objectives. For forward-KL, replay must modify the training distribution to change the population optimum; for reverse-KL, replay leaves the population objective unchanged but prevents finite-batch old-mode starvation through bounded importance weighting. Finally, we analyze three recently proposed near-on-policy post-training methods, SDFT (arxiv:2601.19897), TTT-Discover (arxiv:2601.16175), and OAPL (arxiv:2602.19362), via the same lens and derive explicit conditions under which each retains old mass and exhibits overlap-controlled drift. Overall, our results show that forgetting can by precisely quantified based on the interaction between divergence direction, geometric behavioral overlap, sampling regime, and the visibility of past behavior during training.",2026,Krishnakumar Balasubramanian;Shiva Prasad Kasiviswanathan,arXiv,http://arxiv.org/abs/2603.12163v1,machine translation
arxiv:2603.12151v1,IsoCompute Playbook: Optimally Scaling Sampling Compute for LLM RL,"While scaling laws guide compute allocation for LLM pre-training, analogous prescriptions for reinforcement learning (RL) post-training of large language models (LLMs) remain poorly understood. We study the compute-optimal allocation of sampling compute for on-policy RL methods in LLMs, framing scaling as a compute-constrained optimization over three resources: parallel rollouts per problem, number of problems per batch, and number of update steps. We find that the compute-optimal number of parallel rollouts per problem increases predictably with compute budget and then saturates. This trend holds across both easy and hard problems, though driven by different mechanisms: solution sharpening on easy problems and coverage expansion on hard problems. We further show that increasing the number of parallel rollouts mitigates interference across problems, while the number of problems per batch primarily affects training stability and can be chosen within a broad range. Validated across base models and data distributions, our results recast RL scaling laws as prescriptive allocation rules and provide practical guidance for compute-efficient LLM RL post-training.",2026,Zhoujun Cheng;Yutao Xie;Yuxiao Qu;Amrith Setlur;Shibo Hao;Varad Pimpalkhute;Tongtong Liang;Feng Yao;Zhengzhong Liu;Eric Xing;Virginia Smith;Ruslan Salakhutdinov;Zhiting Hu;Taylor Killian;Aviral Kumar,arXiv,http://arxiv.org/abs/2603.12151v1,machine translation
arxiv:2603.12146v1,FlashMotion: Few-Step Controllable Video Generation with Trajectory Guidance,"Recent advances in trajectory-controllable video generation have achieved remarkable progress. Previous methods mainly use adapter-based architectures for precise motion control along predefined trajectories. However, all these methods rely on a multi-step denoising process, leading to substantial time redundancy and computational overhead. While existing video distillation methods successfully distill multi-step generators into few-step, directly applying these approaches to trajectory-controllable video generation results in noticeable degradation in both video quality and trajectory accuracy. To bridge this gap, we introduce FlashMotion, a novel training framework designed for few-step trajectory-controllable video generation. We first train a trajectory adapter on a multi-step video generator for precise trajectory control. Then, we distill the generator into a few-step version to accelerate video generation. Finally, we finetune the adapter using a hybrid strategy that combines diffusion and adversarial objectives, aligning it with the few-step generator to produce high-quality, trajectory-accurate videos. For evaluation, we introduce FlashBench, a benchmark for long-sequence trajectory-controllable video generation that measures both video quality and trajectory accuracy across varying numbers of foreground objects. Experiments on two adapter architectures show that FlashMotion surpasses existing video distillation methods and previous multi-step models in both visual quality and trajectory consistency.",2026,Quanhao Li;Zhen Xing;Rui Wang;Haidong Cao;Qi Dai;Daoguo Dong;Zuxuan Wu,arXiv,http://arxiv.org/abs/2603.12146v1,machine translation
arxiv:2603.12145v1,Automatic Generation of High-Performance RL Environments,"Translating complex reinforcement learning (RL) environments into high-performance implementations has traditionally required months of specialized engineering. We present a reusable recipe - a generic prompt template, hierarchical verification, and iterative agent-assisted repair - that produces semantically equivalent high-performance environments for <$10 in compute cost. We demonstrate three distinct workflows across five environments. Direct translation (no prior performance implementation exists): EmuRust (1.5x PPO speedup via Rust parallelism for a Game Boy emulator) and PokeJAX, the first GPU-parallel Pokemon battle simulator (500M SPS random action, 15.2M SPS PPO; 22,320x over the TypeScript reference). Translation verified against existing performance implementations: throughput parity with MJX (1.04x) and 5x over Brax at matched GPU batch sizes (HalfCheetah JAX); 42x PPO (Puffer Pong). New environment creation: TCGJax, the first deployable JAX Pokemon TCG engine (717K SPS random action, 153K SPS PPO; 6.6x over the Python reference), synthesized from a web-extracted specification. At 200M parameters, the environment overhead drops below 4% of training time. Hierarchical verification (property, interaction, and rollout tests) confirms semantic equivalence for all five environments; cross-backend policy transfer confirms zero sim-to-sim gap for all five environments. TCGJax, synthesized from a private reference absent from public repositories, serves as a contamination control for agent pretraining data concerns. The paper contains sufficient detail - including representative prompts, verification methodology, and complete results - that a coding agent could reproduce the translations directly from the manuscript.",2026,Seth Karten;Rahul Dev Appapogu;Chi Jin,arXiv,http://arxiv.org/abs/2603.12145v1,machine translation
arxiv:2603.12142v1,Understanding Disclosure Risk in Differential Privacy with Applications to Noise Calibration and Auditing (Extended Version),"Differential Privacy (DP) is widely adopted in data management systems to enable data sharing with formal disclosure guarantees. A central systems challenge is understanding how DP noise translates into effective protection against inference attacks, since this directly determines achievable utility. Most existing analyses focus only on membership inference -- capturing only a threat -- or rely on reconstruction robustness (ReRo). However, under realistic assumptions, we show that ReRo can yield misleading risk estimates and violate claimed bounds, limiting their usefulness for principled DP calibration and auditing. This paper introduces reconstruction advantage, a unified risk metric that consistently captures risk across membership inference, attribute inference, and data reconstruction. We derive tight bounds that relate DP noise to adversarial advantage and characterize optimal adversarial strategies for arbitrary DP mechanisms and attacker knowledge. These results enable risk-driven noise calibration and provide a foundation for systematic DP auditing. We show that reconstruction advantage improves the accuracy and scope of DP auditing and enables more effective utility-privacy trade-offs in DP-enabled data management systems.",2026,Patricia Guerra-Balboa;Annika Sauer;Héber H. Arcolezi;Thorsten Strufe,arXiv,http://arxiv.org/abs/2603.12142v1,machine translation
openalex:W2296283641,Neural Architectures for Named Entity Recognition,"Guillaume Lample, Miguel Ballesteros, Sandeep Subramanian, Kazuya Kawakami, Chris Dyer. Proceedings of the 2016 Conference of the North American Chapter of the Association for Computational Linguistics: Human Language Technologies. 2016.",2016,Guillaume Lample;Miguel Ballesteros;Sandeep Subramanian;Kazuya Kawakami;Chris Dyer,OpenAlex,https://openalex.org/W2296283641,named entity recognition
